{
  "kind": "WorkflowContract",
  "metadata": {
    "workflow_id": "player-protection-case-handling",
    "version": "1.0.0"
  },
  "governance": {
    "risk_tier": "R3"
  },
  "steps": [
    {
      "step_id": "gather-evidence",
      "mode": "automated"
    },
    {
      "step_id": "compliance-approval",
      "mode": "human_review"
    },
    {
      "step_id": "execute-intervention",
      "mode": "automated"
    }
  ],
  "idempotency": {
    "key_path": "$.request_id"
  },
  "compensation": {
    "required": true
  }
}
